{
    "meta": {
        "client_name": "ACME Corp",
        "report_type": "Reporte Ejecutivo de Seguridad",
        "report_date": "2026-01-11",
        "report_version": "1.0",
        "report_id": "RPT-2026-001"
    },
    "assets": {
        "logo_path": "c:/Felipe/Projects/Mapa-rd/report_engine/sample_data/assets/logo.png"
    },
    "ird": {
        "score": 65,
        "level": "Riesgo Crítico",
        "level_class": "critical",
        "vector_count": 3
    },
    "vectors": [
        {
            "id": "VEC-001",
            "title": "Credenciales de Base de Datos Expuestas",
            "asset": "Base de Datos Prod (AWS RDS)",
            "asset_type": "Infraestructura Cloud",
            "exposure_type": "Fuga en Repo Público",
            "irv_score": 85,
            "irv_level": "Máximo",
            "irv_class": "maximum",
            "components": {
                "CA": 5,
                "ET": 5,
                "SE": 5,
                "IM": 4,
                "FE": 5,
                "DV": 5
            },
            "description": "Se identificaron credenciales hardcodeadas para la base de datos principal de producción en un repositorio público de GitHub (config.js). El análisis de logs confirmó eventos de clonación no autorizados.",
            "impact_bullets": [
                "Compromiso total de datos de clientes (PII).",
                "Potencial interrupción total del servicio (Ransomware).",
                "Multas regulatorias severas (GDPR/Ley de Datos). "
            ],
            "remediation_steps": [
                "Revocar las credenciales IAM de AWS expuestas inmediatamente.",
                "Rotar la contraseña maestra de la base de datos.",
                "Auditar logs de CloudTrail buscando actividad sospechosa desde la fecha del commit.",
                "Implementar git-secrets para prevenir futuros commits de secretos."
            ]
        },
        {
            "id": "VEC-002",
            "title": "Portal de Administración sin MFA",
            "asset": "admin.acme.com",
            "asset_type": "Aplicación Web",
            "exposure_type": "Control Faltante",
            "irv_score": 60,
            "irv_level": "Crítico",
            "irv_class": "critical",
            "components": {
                "CA": 4,
                "ET": 5,
                "SE": 4,
                "IM": 3,
                "FE": 4,
                "DV": 3
            },
            "description": "El panel administrativo permite autenticación de un solo factor. Ataques de fuerza bruta o relleno de credenciales podrían comprometer fácilmente una cuenta de administrador.",
            "impact_bullets": [
                "Acceso administrativo no autorizado.",
                "Manipulación o eliminación de datos.",
                "Instalación de puertas traseras (Backdoors)."
            ],
            "remediation_steps": [
                "Forzar MFA (OTP basado en tiempo) para todos los roles administrativos.",
                "Restringir el acceso solo a VPN o IPs de confianza.",
                "Implementar limitación de tasa (rate-limiting) en el endpoint de login."
            ]
        },
        {
            "id": "VEC-003",
            "title": "Certificado SSL Desactualizado",
            "asset": "dev.acme.com",
            "asset_type": "Entorno de Desarrollo",
            "exposure_type": "Configuración",
            "irv_score": 35,
            "irv_level": "Medio",
            "irv_class": "medium",
            "components": {
                "CA": 2,
                "ET": 3,
                "SE": 2,
                "IM": 1,
                "FE": 2,
                "DV": 5
            },
            "description": "El certificado SSL para el entorno de desarrollo ha expirado, provocando advertencias en el navegador y exponiendo el tráfico a interceptación.",
            "impact_bullets": [
                "Disrupción del flujo de trabajo de los desarrolladores.",
                "Riesgo de Man-in-the-Middle (MitM) si se usa externamente.",
                "Pérdida de validación de confianza."
            ],
            "remediation_steps": [
                "Aprovisionar un nuevo certificado (ej. LetsEncrypt).",
                "Automatizar la renovación vía Certbot."
            ]
        }
    ]
}